Ticker,name,summary,category,aum,pe,expense_ratio,top_holdings,sector_weights
MORT,VanEck Mortgage REIT Income ETF,"The fund normally invests at least 80% of its total assets in securities that comprise the fund's benchmark index. The Mortgage REITs Index may include small-, medium- and large-capitalization companies. The fund is non-diversified.",Real Estate,399810400,8.420423,0.0043,"[{""Symbol"":""NLY"",""Name"":""Annaly Capital Management Inc"",""Holding Percent"":0.1817705},{""Symbol"":""AGNC"",""Name"":""AGNC Investment Corp"",""Holding Percent"":0.1454512},{""Symbol"":""STWD"",""Name"":""Starwood Property Trust Inc"",""Holding Percent"":0.0690606},{""Symbol"":""RITM"",""Name"":""Rithm Capital Corp"",""Holding Percent"":0.0641027},{""Symbol"":""DX"",""Name"":""Dynex Capital Inc"",""Holding Percent"":0.049864303},{""Symbol"":""ARR"",""Name"":""ARMOUR Residential REIT Inc"",""Holding Percent"":0.0447644},{""Symbol"":""EFC"",""Name"":""Ellington Financial Inc"",""Holding Percent"":0.043639302},{""Symbol"":""ORC"",""Name"":""Orchid Island Capital Inc"",""Holding Percent"":0.042097997},{""Symbol"":""BXMT"",""Name"":""Blackstone Mortgage Trust Inc Class A"",""Holding Percent"":0.0415172},{""Symbol"":""TWO"",""Name"":""Two Harbors Investment Corp"",""Holding Percent"":0.0308843}]","{""realestate"": 1.0, ""consumer_cyclical"": 0.0, ""basic_materials"": 0.0, ""consumer_defensive"": 0.0, ""technology"": 0.0, ""communication_services"": 0.0, ""financial_services"": 0.0, ""utilities"": 0.0, ""industrials"": 0.0, ""energy"": 0.0, ""healthcare"": 0.0}"
INDS,Pacer Benchmark Industrial Real Estate SCTR ETF,"The index is generally composed of the equity securities of developed markets companies that derive at least 85% of their earnings or revenues from real estate operations in the industrial real estate sector, including companies that derive at least 85% of their earnings or revenues from self-storage real estate operations. The fund will invest at least 80% of the value of its net assets, plus the amount of any borrowings for investment purposes, in companies the industrial real estate sector. The fund is non-diversified.",Real Estate,114586672,27.261354,0.0049,"[{""Symbol"":""PSA"",""Name"":""Public Storage"",""Holding Percent"":0.1488981},{""Symbol"":""EXR"",""Name"":""Extra Space Storage Inc"",""Holding Percent"":0.147101},{""Symbol"":""PLD"",""Name"":""Prologis Inc"",""Holding Percent"":0.1388646},{""Symbol"":""SGRO.L"",""Name"":""Segro PLC"",""Holding Percent"":0.0527834},{""Symbol"":""EGP"",""Name"":""EastGroup Properties Inc"",""Holding Percent"":0.044849902},{""Symbol"":""WPC"",""Name"":""W.P. Carey Inc"",""Holding Percent"":0.0426336},{""Symbol"":""CUBE"",""Name"":""CubeSmart"",""Holding Percent"":0.0377477},{""Symbol"":""FR"",""Name"":""First Industrial Realty Trust Inc"",""Holding Percent"":0.0337303},{""Symbol"":""REXR"",""Name"":""Rexford Industrial Realty Inc"",""Holding Percent"":0.031723198},{""Symbol"":""STAG"",""Name"":""Stag Industrial Inc"",""Holding Percent"":0.030428}]","{""realestate"": 1.0, ""consumer_cyclical"": 0.0, ""basic_materials"": 0.0, ""consumer_defensive"": 0.0, ""technology"": 0.0, ""communication_services"": 0.0, ""financial_services"": 0.0, ""utilities"": 0.0, ""industrials"": 0.0, ""energy"": 0.0, ""healthcare"": 0.0}"
FMAT,Fidelity MSCI Materials Index ETF,"The fund invests at least 80% of assets in securities included in the fund's underlying index. The fund's underlying index is the MSCI USA IMI Materials 25/50 Index, which represents the performance of the materials sector in the U.S. equity market. It may or may not hold all of the securities in the MSCI USA IMI Materials 25/50 Index. The fund is non-diversified.",Natural Resources,623540800,24.175375,0.00084,"[{""Symbol"":""LIN"",""Name"":""Linde PLC"",""Holding Percent"":0.1555968},{""Symbol"":""NEM"",""Name"":""Newmont Corp"",""Holding Percent"":0.0670591},{""Symbol"":""FCX"",""Name"":""Freeport-McMoRan Inc"",""Holding Percent"":0.0581864},{""Symbol"":""SHW"",""Name"":""Sherwin-Williams Co"",""Holding Percent"":0.0531593},{""Symbol"":""CRH"",""Name"":""CRH PLC"",""Holding Percent"":0.0478827},{""Symbol"":""ECL"",""Name"":""Ecolab Inc"",""Holding Percent"":0.0465277},{""Symbol"":""APD"",""Name"":""Air Products and Chemicals Inc"",""Holding Percent"":0.0377113},{""Symbol"":""CTVA"",""Name"":""Corteva Inc"",""Holding Percent"":0.036774598},{""Symbol"":""NUE"",""Name"":""Nucor Corp"",""Holding Percent"":0.033352003},{""Symbol"":""VMC"",""Name"":""Vulcan Materials Co"",""Holding Percent"":0.026042901}]","{""realestate"": 0.0, ""consumer_cyclical"": 0.094, ""basic_materials"": 0.8912, ""consumer_defensive"": 0.0, ""technology"": 0.0, ""communication_services"": 0.0, ""financial_services"": 0.0, ""utilities"": 0.0, ""industrials"": 0.0095, ""energy"": 0.0, ""healthcare"": 0.0053}"
XRT,State Street SPDR S&P Retail ETF,"In seeking to track the performance of the S&P Retail Select Industry Index (the ""index""), the fund employs a sampling strategy. It generally invests substantially all, but at least 80%, of its total assets in the securities comprising the index. The index represents the retail segment of the S&P Total Market Index (""S&P TMI"").",Consumer Cyclical,381375040,16.711493,0.0034999999999999996,"[{""Symbol"":""GRPN"",""Name"":""Groupon Inc"",""Holding Percent"":0.0177702},{""Symbol"":""REAL"",""Name"":""The RealReal Inc"",""Holding Percent"":0.017470501},{""Symbol"":""BBWI"",""Name"":""Bath & Body Works Inc"",""Holding Percent"":0.01725},{""Symbol"":""WRBY"",""Name"":""Warby Parker Inc Ordinary Shares - Class A"",""Holding Percent"":0.0163885},{""Symbol"":""UPBD"",""Name"":""Upbound Group Inc"",""Holding Percent"":0.0158606},{""Symbol"":""CART"",""Name"":""Maplebear Inc"",""Holding Percent"":0.0155269},{""Symbol"":""CPNG"",""Name"":""Coupang Inc Ordinary Shares - Class A"",""Holding Percent"":0.0155246},{""Symbol"":""RVLV"",""Name"":""Revolve Group Inc Class A"",""Holding Percent"":0.015200401},{""Symbol"":""VSXY"",""Name"":""Victoria's Secret & Co"",""Holding Percent"":0.015195301},{""Symbol"":""HZO"",""Name"":""MarineMax Inc"",""Holding Percent"":0.0151818}]","{""realestate"": 0.0, ""consumer_cyclical"": 0.7524, ""basic_materials"": 0.0, ""consumer_defensive"": 0.1866, ""technology"": 0.026700001, ""communication_services"": 0.0178, ""financial_services"": 0.0, ""utilities"": 0.0, ""industrials"": 0.0, ""energy"": 0.0, ""healthcare"": 0.0164}"
COPX,Global X Copper Miners ETF,"The fund invests at least 80% of its total assets in the securities of the underlying index and in American Depositary Receipts (""ADRs"") and Global Depositary Receipts (""GDRs"") based on the securities in the underlying index. The underlying index is designed to measure broad-based equity market performance of global companies involved in the copper mining industry. The fund is non-diversified.",Natural Resources,7154050560,17.519611,0.006500000000000001,"[{""Symbol"":""HBM.TO"",""Name"":""Hudbay Minerals Inc"",""Holding Percent"":0.056178197},{""Symbol"":""TECK-B.TO"",""Name"":""Teck Resources Ltd Class B (Sub Voting)"",""Holding Percent"":0.0546317},{""Symbol"":""BHP.AX"",""Name"":""BHP Group Ltd"",""Holding Percent"":0.054586},{""Symbol"":""ANTO.L"",""Name"":""Antofagasta PLC"",""Holding Percent"":0.0527731},{""Symbol"":""KGH.WA"",""Name"":""KGHM Polska Miedz SA"",""Holding Percent"":0.0522129},{""Symbol"":""FM.TO"",""Name"":""First Quantum Minerals Ltd"",""Holding Percent"":0.0508742},{""Symbol"":""BOL.ST"",""Name"":""Boliden AB"",""Holding Percent"":0.0504123},{""Symbol"":""SCCO"",""Name"":""Southern Copper Corp"",""Holding Percent"":0.0496114},{""Symbol"":""FCX"",""Name"":""Freeport-McMoRan Inc"",""Holding Percent"":0.0488748},{""Symbol"":""GLEN.L"",""Name"":""Glencore PLC"",""Holding Percent"":0.048022598}]","{""realestate"": 0.0, ""consumer_cyclical"": 0.0, ""basic_materials"": 0.96870005, ""consumer_defensive"": 0.0, ""technology"": 0.0, ""communication_services"": 0.0, ""financial_services"": 0.0, ""utilities"": 0.0, ""industrials"": 0.0313, ""energy"": 0.0, ""healthcare"": 0.0}"
GDX,VanEck Gold Miners ETF,"The fund normally invests at least 80% of its total assets in securities that comprise the fund’s benchmark index. The index is a modified capitalization weighted, float-adjusted index comprised of publicly traded companies primarily involved in the gold and silver mining industry. The fund is non-diversified.",Equity Precious Metals,22753128448,13.51468,0.0051,"[{""Symbol"":""AEM.TO"",""Name"":""Agnico Eagle Mines Ltd"",""Holding Percent"":0.1052023},{""Symbol"":""NEM"",""Name"":""Newmont Corp"",""Holding Percent"":0.1048356},{""Symbol"":""ABX.TO"",""Name"":""Barrick Mining Corp"",""Holding Percent"":0.079513},{""Symbol"":""WPM.TO"",""Name"":""Wheaton Precious Metals Corp"",""Holding Percent"":0.0550701},{""Symbol"":""AU"",""Name"":""Anglogold Ashanti PLC"",""Holding Percent"":0.0507249},{""Symbol"":""FNV.TO"",""Name"":""Franco-Nevada Corp"",""Holding Percent"":0.048395},{""Symbol"":""K.TO"",""Name"":""Kinross Gold Corp"",""Holding Percent"":0.044019297},{""Symbol"":""GFI"",""Name"":""Gold Fields Ltd ADR"",""Holding Percent"":0.040145997},{""Symbol"":""PAAS.TO"",""Name"":""Pan American Silver Corp"",""Holding Percent"":0.0295106},{""Symbol"":""NST.AX"",""Name"":""Northern Star Resources Ltd"",""Holding Percent"":0.0270137}]","{""realestate"": 0.0, ""consumer_cyclical"": 0.0, ""basic_materials"": 1.0, ""consumer_defensive"": 0.0, ""technology"": 0.0, ""communication_services"": 0.0, ""financial_services"": 0.0, ""utilities"": 0.0, ""industrials"": 0.0, ""energy"": 0.0, ""healthcare"": 0.0}"
